linear-algebra/labels-spaces.json

[
  {
    "label": "sect--spaces",
    "anchor": "sect-spaces",
    "number": "3",
    "destination": "chapter.3",
    "type_code": "chapter",
    "type_name": "Chapter"
  },
  {
    "label": "def:ordered-tuple",
    "anchor": "def-ordered-tuple",
    "number": "3.1",
    "destination": "Defi.3.1",
    "type_code": "Defi",
    "type_name": "Definition"
  },
  {
    "label": "def:vector-space",
    "anchor": "def-vector-space",
    "number": "3.10",
    "destination": "Defi.3.10",
    "type_code": "Defi",
    "type_name": "Definition"
  },
  {
    "label": "ex:spaces-example-003",
    "anchor": "ex-spaces-example-003",
    "number": "3.11",
    "destination": "Bsp.3.11",
    "type_code": "Bsp",
    "type_name": "Example"
  },
  {
    "label": "rem:spaces-remark-002",
    "anchor": "rem-spaces-remark-002",
    "number": "3.12",
    "destination": "Bem.3.12",
    "type_code": "Bem",
    "type_name": "Remark"
  },
  {
    "label": "ex:non-vector-spaces",
    "anchor": "ex-non-vector-spaces",
    "number": "3.13",
    "destination": "Bsp.3.13",
    "type_code": "Bsp",
    "type_name": "Example"
  },
  {
    "label": "homogeneous.system",
    "anchor": "homogeneous-system",
    "number": "3.14",
    "destination": "equation.3.14",
    "type_code": "equation",
    "type_name": "Equation"
  },
  {
    "label": "ex:spaces-example-005",
    "anchor": "ex-spaces-example-005",
    "number": "3.15",
    "destination": "Bsp.3.15",
    "type_code": "Bsp",
    "type_name": "Example"
  },
  {
    "label": "ex:spaces-example-006",
    "anchor": "ex-spaces-example-006",
    "number": "3.16",
    "destination": "Bsp.3.16",
    "type_code": "Bsp",
    "type_name": "Example"
  },
  {
    "label": "def:subspace",
    "anchor": "def-subspace",
    "number": "3.17",
    "destination": "Defi.3.17",
    "type_code": "Defi",
    "type_name": "Definition"
  },
  {
    "label": "prop:homogeneous-system-subspace",
    "anchor": "prop-homogeneous-system-subspace",
    "number": "3.18",
    "destination": "mySatz.3.18",
    "type_code": "mySatz",
    "type_name": "Proposition"
  },
  {
    "label": "lem:spaces-lemma-003",
    "anchor": "lem-spaces-lemma-003",
    "number": "3.19",
    "destination": "lemma.3.19",
    "type_code": "lemma",
    "type_name": "Lemma"
  },
  {
    "label": "def:spaces-definition-002",
    "anchor": "def-spaces-definition-002",
    "number": "3.2",
    "destination": "Defi.3.2",
    "type_code": "Defi",
    "type_name": "Definition"
  },
  {
    "label": "ex:spaces-example-007",
    "anchor": "ex-spaces-example-007",
    "number": "3.20",
    "destination": "Bsp.3.20",
    "type_code": "Bsp",
    "type_name": "Example"
  },
  {
    "label": "q:dimension-intersection",
    "anchor": "q-dimension-intersection",
    "number": "3.21",
    "destination": "Ques.3.21",
    "type_code": "Ques",
    "type_name": "Question"
  },
  {
    "label": "dlm:polynomials-vector-space",
    "anchor": "dlm-polynomials-vector-space",
    "number": "3.22",
    "destination": "DefiLemm.3.22",
    "type_code": "DefiLemm",
    "type_name": "Definition and Lemma"
  },
  {
    "label": "scalar multiple functions",
    "anchor": "scalar-multiple-functions",
    "number": "3.22",
    "destination": "DefiLemm.3.22",
    "type_code": "DefiLemm",
    "type_name": "Definition and Lemma"
  },
  {
    "label": "sum functions",
    "anchor": "sum-functions",
    "number": "3.22",
    "destination": "DefiLemm.3.22",
    "type_code": "DefiLemm",
    "type_name": "Definition and Lemma"
  },
  {
    "label": "rem:spaces-remark-003",
    "anchor": "rem-spaces-remark-003",
    "number": "3.23",
    "destination": "Bem.3.23",
    "type_code": "Bem",
    "type_name": "Remark"
  },
  {
    "label": "rem:spaces-remark-004",
    "anchor": "rem-spaces-remark-004",
    "number": "3.24",
    "destination": "Bem.3.24",
    "type_code": "Bem",
    "type_name": "Remark"
  },
  {
    "label": "dlm:direct-sum",
    "anchor": "dlm-direct-sum",
    "number": "3.25",
    "destination": "DefiLemm.3.25",
    "type_code": "DefiLemm",
    "type_name": "Definition and Lemma"
  },
  {
    "label": "ex:spaces-example-008",
    "anchor": "ex-spaces-example-008",
    "number": "3.26",
    "destination": "Bsp.3.26",
    "type_code": "Bsp",
    "type_name": "Example"
  },
  {
    "label": "ex:spaces-example-009",
    "anchor": "ex-spaces-example-009",
    "number": "3.27",
    "destination": "Bsp.3.27",
    "type_code": "Bsp",
    "type_name": "Example"
  },
  {
    "label": "def:spaces-definition-007",
    "anchor": "def-spaces-definition-007",
    "number": "3.28",
    "destination": "Defi.3.28",
    "type_code": "Defi",
    "type_name": "Definition"
  },
  {
    "label": "def:spaces-definition-008",
    "anchor": "def-spaces-definition-008",
    "number": "3.29",
    "destination": "Defi.3.29",
    "type_code": "Defi",
    "type_name": "Definition"
  },
  {
    "label": "def:vector-sum",
    "anchor": "def-vector-sum",
    "number": "3.3",
    "destination": "Defi.3.3",
    "type_code": "Defi",
    "type_name": "Definition"
  },
  {
    "label": "sect:intersection-of-subspaces",
    "anchor": "sect-intersection-of-subspaces",
    "number": "3.3",
    "destination": "section.3.3",
    "type_code": "section",
    "type_name": "Section"
  },
  {
    "label": "ex:spaces-example-010",
    "anchor": "ex-spaces-example-010",
    "number": "3.30",
    "destination": "Bsp.3.30",
    "type_code": "Bsp",
    "type_name": "Example"
  },
  {
    "label": "ex:span-2",
    "anchor": "ex-span-2",
    "number": "3.31",
    "destination": "Bsp.3.31",
    "type_code": "Bsp",
    "type_name": "Example"
  },
  {
    "label": "lem:span-subspace",
    "anchor": "lem-span-subspace",
    "number": "3.32",
    "destination": "lemma.3.32",
    "type_code": "lemma",
    "type_name": "Lemma"
  },
  {
    "label": "ex:spaces-example-012",
    "anchor": "ex-spaces-example-012",
    "number": "3.33",
    "destination": "Bsp.3.33",
    "type_code": "Bsp",
    "type_name": "Example"
  },
  {
    "label": "def:sum-of-vector-spaces",
    "anchor": "def-sum-of-vector-spaces",
    "number": "3.34",
    "destination": "Defi.3.34",
    "type_code": "Defi",
    "type_name": "Definition"
  },
  {
    "label": "lem:spaces-lemma-005",
    "anchor": "lem-spaces-lemma-005",
    "number": "3.35",
    "destination": "lemma.3.35",
    "type_code": "lemma",
    "type_name": "Lemma"
  },
  {
    "label": "rem:spaces-remark-005",
    "anchor": "rem-spaces-remark-005",
    "number": "3.36",
    "destination": "Bem.3.36",
    "type_code": "Bem",
    "type_name": "Remark"
  },
  {
    "label": "rem:spaces-remark-006",
    "anchor": "rem-spaces-remark-006",
    "number": "3.37",
    "destination": "Bem.3.37",
    "type_code": "Bem",
    "type_name": "Remark"
  },
  {
    "label": "rem:spaces-remark-007",
    "anchor": "rem-spaces-remark-007",
    "number": "3.38",
    "destination": "Bem.3.38",
    "type_code": "Bem",
    "type_name": "Remark"
  },
  {
    "label": "q:dimension-sum",
    "anchor": "q-dimension-sum",
    "number": "3.39",
    "destination": "Ques.3.39",
    "type_code": "Ques",
    "type_name": "Question"
  },
  {
    "label": "ex:spaces-example-001",
    "anchor": "ex-spaces-example-001",
    "number": "3.4",
    "destination": "Bsp.3.4",
    "type_code": "Bsp",
    "type_name": "Example"
  },
  {
    "label": "def:generating-system",
    "anchor": "def-generating-system",
    "number": "3.40",
    "destination": "Defi.3.40",
    "type_code": "Defi",
    "type_name": "Definition"
  },
  {
    "label": "ex:standard-basis-generate",
    "anchor": "ex-standard-basis-generate",
    "number": "3.41",
    "destination": "Bsp.3.41",
    "type_code": "Bsp",
    "type_name": "Example"
  },
  {
    "label": "ex:spaces-example-014",
    "anchor": "ex-spaces-example-014",
    "number": "3.42",
    "destination": "Bsp.3.42",
    "type_code": "Bsp",
    "type_name": "Example"
  },
  {
    "label": "ex:three-vectors-no-span",
    "anchor": "ex-three-vectors-no-span",
    "number": "3.43",
    "destination": "Bsp.3.43",
    "type_code": "Bsp",
    "type_name": "Example"
  },
  {
    "label": "met:check-generating-system",
    "anchor": "met-check-generating-system",
    "number": "3.44",
    "destination": "Meth.3.44",
    "type_code": "Meth",
    "type_name": "Method"
  },
  {
    "label": "cor:spaces-corollary-001",
    "anchor": "cor-spaces-corollary-001",
    "number": "3.45",
    "destination": "Coro.3.45",
    "type_code": "Coro",
    "type_name": "Corollary"
  },
  {
    "label": "def:linearly-independent",
    "anchor": "def-linearly-independent",
    "number": "3.46",
    "destination": "Defi.3.46",
    "type_code": "Defi",
    "type_name": "Definition"
  },
  {
    "label": "eqn--lin dep def",
    "anchor": "eqn-lin-dep-def",
    "number": "3.47",
    "destination": "equation.3.47",
    "type_code": "equation",
    "type_name": "Equation"
  },
  {
    "label": "ex:standard-basis-linearly-independent",
    "anchor": "ex-standard-basis-linearly-independent",
    "number": "3.48",
    "destination": "Bsp.3.48",
    "type_code": "Bsp",
    "type_name": "Example"
  },
  {
    "label": "ex:three-vectors-linearly-dependent",
    "anchor": "ex-three-vectors-linearly-dependent",
    "number": "3.49",
    "destination": "Bsp.3.49",
    "type_code": "Bsp",
    "type_name": "Example"
  },
  {
    "label": "rem:spaces-remark-001",
    "anchor": "rem-spaces-remark-001",
    "number": "3.5",
    "destination": "Bem.3.5",
    "type_code": "Bem",
    "type_name": "Remark"
  },
  {
    "label": "ex:spaces-example-018",
    "anchor": "ex-spaces-example-018",
    "number": "3.50",
    "destination": "Bsp.3.50",
    "type_code": "Bsp",
    "type_name": "Example"
  },
  {
    "label": "lem:independent-linear-combination",
    "anchor": "lem-independent-linear-combination",
    "number": "3.51",
    "destination": "lemma.3.51",
    "type_code": "lemma",
    "type_name": "Lemma"
  },
  {
    "label": "eqn--lin dep",
    "anchor": "eqn-lin-dep",
    "number": "3.52",
    "destination": "equation.3.52",
    "type_code": "equation",
    "type_name": "Equation"
  },
  {
    "label": "met:check-linear-independence",
    "anchor": "met-check-linear-independence",
    "number": "3.53",
    "destination": "Meth.3.53",
    "type_code": "Meth",
    "type_name": "Method"
  },
  {
    "label": "cor:spaces-corollary-002",
    "anchor": "cor-spaces-corollary-002",
    "number": "3.54",
    "destination": "Coro.3.54",
    "type_code": "Coro",
    "type_name": "Corollary"
  },
  {
    "label": "rem:spaces-remark-008",
    "anchor": "rem-spaces-remark-008",
    "number": "3.55",
    "destination": "Bem.3.55",
    "type_code": "Bem",
    "type_name": "Remark"
  },
  {
    "label": "ex:three-vectors-linearly-dependent-02",
    "anchor": "ex-three-vectors-linearly-dependent-02",
    "number": "3.56",
    "destination": "Bsp.3.56",
    "type_code": "Bsp",
    "type_name": "Example"
  },
  {
    "label": "prop:linearly-independent-unique",
    "anchor": "prop-linearly-independent-unique",
    "number": "3.57",
    "destination": "mySatz.3.57",
    "type_code": "mySatz",
    "type_name": "Proposition"
  },
  {
    "label": "def:basis",
    "anchor": "def-basis",
    "number": "3.58",
    "destination": "Defi.3.58",
    "type_code": "Defi",
    "type_name": "Definition"
  },
  {
    "label": "ex:standard-basis",
    "anchor": "ex-standard-basis",
    "number": "3.59",
    "destination": "Bsp.3.59",
    "type_code": "Bsp",
    "type_name": "Example"
  },
  {
    "label": "0.combiniation",
    "anchor": "0-combiniation",
    "number": "3.6",
    "destination": "section.3.6",
    "type_code": "section",
    "type_name": "Section"
  },
  {
    "label": "lem:properties-vector-addition",
    "anchor": "lem-properties-vector-addition",
    "number": "3.6",
    "destination": "lemma.3.6",
    "type_code": "lemma",
    "type_name": "Lemma"
  },
  {
    "label": "ex:three-vectors-basis",
    "anchor": "ex-three-vectors-basis",
    "number": "3.60",
    "destination": "Bsp.3.60",
    "type_code": "Bsp",
    "type_name": "Example"
  },
  {
    "label": "prop:basis-coordinate-system",
    "anchor": "prop-basis-coordinate-system",
    "number": "3.61",
    "destination": "mySatz.3.61",
    "type_code": "mySatz",
    "type_name": "Proposition"
  },
  {
    "label": "thm:spaces-theorem-001",
    "anchor": "thm-spaces-theorem-001",
    "number": "3.62",
    "destination": "Theo.3.62",
    "type_code": "Theo",
    "type_name": "Theorem"
  },
  {
    "label": "def:dimension",
    "anchor": "def-dimension",
    "number": "3.63",
    "destination": "Defi.3.63",
    "type_code": "Defi",
    "type_name": "Definition"
  },
  {
    "label": "def:spaces-definition-013",
    "anchor": "def-spaces-definition-013",
    "number": "3.63",
    "destination": "Defi.3.63",
    "type_code": "Defi",
    "type_name": "Definition"
  },
  {
    "label": "ex:dimensions-examples",
    "anchor": "ex-dimensions-examples",
    "number": "3.64",
    "destination": "Bsp.3.64",
    "type_code": "Bsp",
    "type_name": "Example"
  },
  {
    "label": "rem:dimension-direct-sum",
    "anchor": "rem-dimension-direct-sum",
    "number": "3.65",
    "destination": "Bem.3.65",
    "type_code": "Bem",
    "type_name": "Remark"
  },
  {
    "label": "thm:spaces-theorem-002",
    "anchor": "thm-spaces-theorem-002",
    "number": "3.66",
    "destination": "Theo.3.66",
    "type_code": "Theo",
    "type_name": "Theorem"
  },
  {
    "label": "rem:spaces-remark-009",
    "anchor": "rem-spaces-remark-009",
    "number": "3.67",
    "destination": "Bem.3.67",
    "type_code": "Bem",
    "type_name": "Remark"
  },
  {
    "label": "thm:basis-theorem",
    "anchor": "thm-basis-theorem",
    "number": "3.68",
    "destination": "Theo.3.68",
    "type_code": "Theo",
    "type_name": "Theorem"
  },
  {
    "label": "ex:spaces-example-023",
    "anchor": "ex-spaces-example-023",
    "number": "3.69",
    "destination": "Bsp.3.69",
    "type_code": "Bsp",
    "type_name": "Example"
  },
  {
    "label": "def:scalar-multiplication",
    "anchor": "def-scalar-multiplication",
    "number": "3.7",
    "destination": "Defi.3.7",
    "type_code": "Defi",
    "type_name": "Definition"
  },
  {
    "label": "cor:indep-span",
    "anchor": "cor-indep-span",
    "number": "3.70",
    "destination": "Coro.3.70",
    "type_code": "Coro",
    "type_name": "Corollary"
  },
  {
    "label": "rem:spaces-remark-010",
    "anchor": "rem-spaces-remark-010",
    "number": "3.71",
    "destination": "Bem.3.71",
    "type_code": "Bem",
    "type_name": "Remark"
  },
  {
    "label": "ex:spaces-example-024",
    "anchor": "ex-spaces-example-024",
    "number": "3.72",
    "destination": "Bsp.3.72",
    "type_code": "Bsp",
    "type_name": "Example"
  },
  {
    "label": "cor:dim-sum-inequality",
    "anchor": "cor-dim-sum-inequality",
    "number": "3.73",
    "destination": "Coro.3.73",
    "type_code": "Coro",
    "type_name": "Corollary"
  },
  {
    "label": "eqn.dim.cap.sum",
    "anchor": "eqn-dim-cap-sum",
    "number": "3.74",
    "destination": "Theo.3.74",
    "type_code": "Theo",
    "type_name": "Theorem"
  },
  {
    "label": "thm:dim-cap-sum",
    "anchor": "thm-dim-cap-sum",
    "number": "3.74",
    "destination": "Theo.3.74",
    "type_code": "Theo",
    "type_name": "Theorem"
  },
  {
    "label": "def:spaces-definition-014",
    "anchor": "def-spaces-definition-014",
    "number": "3.75",
    "destination": "Defi.3.75",
    "type_code": "Defi",
    "type_name": "Definition"
  },
  {
    "label": "ex:spaces-example-025",
    "anchor": "ex-spaces-example-025",
    "number": "3.76",
    "destination": "Bsp.3.76",
    "type_code": "Bsp",
    "type_name": "Example"
  },
  {
    "label": "ex:spaces-example-026",
    "anchor": "ex-spaces-example-026",
    "number": "3.77",
    "destination": "Bsp.3.77",
    "type_code": "Bsp",
    "type_name": "Example"
  },
  {
    "label": "ex:spaces-example-002",
    "anchor": "ex-spaces-example-002",
    "number": "3.8",
    "destination": "Bsp.3.8",
    "type_code": "Bsp",
    "type_name": "Example"
  },
  {
    "label": "lem:properties-scalar-multiplication",
    "anchor": "lem-properties-scalar-multiplication",
    "number": "3.9",
    "destination": "lemma.3.9",
    "type_code": "lemma",
    "type_name": "Lemma"
  },
  {
    "label": "ex poly span 1",
    "anchor": "ex-poly-span-1",
    "number": "3.{10}",
    "destination": "Ueba.3.10",
    "type_code": "Ueba",
    "type_name": "Exercise"
  },
  {
    "label": "ex poly span 2",
    "anchor": "ex-poly-span-2",
    "number": "3.{11}",
    "destination": "Ueba.3.11",
    "type_code": "Ueba",
    "type_name": "Exercise"
  },
  {
    "label": "base change matrix",
    "anchor": "base-change-matrix",
    "number": "3.{12}",
    "destination": "Ueba.3.12",
    "type_code": "Ueba",
    "type_name": "Exercise"
  },
  {
    "label": "ex 2.1",
    "anchor": "ex-2-1",
    "number": "3.{13}",
    "destination": "Ueba.3.13",
    "type_code": "Ueba",
    "type_name": "Exercise"
  },
  {
    "label": "ex 2.2",
    "anchor": "ex-2-2",
    "number": "3.{15}",
    "destination": "Ueba.3.15",
    "type_code": "Ueba",
    "type_name": "Exercise"
  },
  {
    "label": "ex 2.3",
    "anchor": "ex-2-3",
    "number": "3.{16}",
    "destination": "Ueba.3.16",
    "type_code": "Ueba",
    "type_name": "Exercise"
  },
  {
    "label": "ueb:exotic-scalar-multiplication",
    "anchor": "ueb-exotic-scalar-multiplication",
    "number": "3.{1}",
    "destination": "Ueba.3.1",
    "type_code": "Ueba",
    "type_name": "Exercise"
  },
  {
    "label": "ex 2.4",
    "anchor": "ex-2-4",
    "number": "3.{25}",
    "destination": "Ueba.3.25",
    "type_code": "Ueba",
    "type_name": "Exercise"
  },
  {
    "label": "ex 2.5",
    "anchor": "ex-2-5",
    "number": "3.{27}",
    "destination": "Ueba.3.27",
    "type_code": "Ueba",
    "type_name": "Exercise"
  },
  {
    "label": "ex 2.6",
    "anchor": "ex-2-6",
    "number": "3.{28}",
    "destination": "Ueba.3.28",
    "type_code": "Ueba",
    "type_name": "Exercise"
  },
  {
    "label": "differentiable functions",
    "anchor": "differentiable-functions",
    "number": "3.{3}",
    "destination": "Ueba.3.3",
    "type_code": "Ueba",
    "type_name": "Exercise"
  },
  {
    "label": "item--generators.remove",
    "anchor": "item-generators-remove",
    "number": "{{(1)}}",
    "destination": "Item.44",
    "type_code": "enumi",
    "type_name": "enumi"
  },
  {
    "label": "item--independent.add",
    "anchor": "item-independent-add",
    "number": "{{(2)}}",
    "destination": "Item.45",
    "type_code": "enumi",
    "type_name": "enumi"
  },
  {
    "label": "item--dim.subspace",
    "anchor": "item-dim-subspace",
    "number": "{{(3)}}",
    "destination": "Item.46",
    "type_code": "enumi",
    "type_name": "enumi"
  },
  {
    "label": "item--distributive law",
    "anchor": "item-distributive-law",
    "number": "{{(4)}}",
    "destination": "Item.33",
    "type_code": "enumi",
    "type_name": "enumi"
  },
  {
    "label": "item--multiplication.law",
    "anchor": "item-multiplication-law",
    "number": "{{(6)}}",
    "destination": "Item.35",
    "type_code": "enumi",
    "type_name": "enumi"
  },
  {
    "label": "item--product 0",
    "anchor": "item-product-0",
    "number": "{{(8)}}",
    "destination": "Item.37",
    "type_code": "enumi",
    "type_name": "enumi"
  }
]

lectures/linear-algebra/spaces-linear-combinations.md

# Linear combinations

<p class="env-number"><strong>Definition 3.31</strong> (Related exercises: <a href="../exercises-spaces/#base-change-matrix">Exercise 3.12</a>, <a href="../exercises-spaces/#ex-poly-span-1">Exercise 3.10</a>, <a href="../exercises-spaces/#ex-poly-span-2">Exercise 3.11</a>, <a href="../exercises-spaces/#ex-linear-combination-r3">Exercise 3.19</a>)</p>

Given two vectors $v_1, v_2 \in {\bf R}^3$, we will see later (<a href="../spaces-dimension/#thm-basis-theorem" data-reference-type="ref+Label" data-reference="thm:basis-theorem">Theorem 3.71</a>) that there will always be some vector $w \in {\bf R}^3$ (in fact infinitely many) that is *not* a linear combination of $v_1$ and $v_2$. In the above example any vector $w = (x,y,z)$ with $z \ne 0$ has that property. Continuing with that example, the $x-y$-plane inside ${\bf R}^3$, i.e., $V := \{(x,y,z) \ | \ x, y \in {\bf R}, z = 0\} = \{(x,y,0) \ | \ x, y \in {\bf R} \}$ is a subspace of ${\bf R}^3$: it contains $(0,0,0)$ and given any two vectors $v, w \in V$ we have $v+w \in V$ and given $r \in {\bf R}$, $r v \in V$ (convince yourself this is true!). We can alternatively use <a href="../spaces-definition-solution-of-homogeneous/#prop-homogeneous-system-subspace" data-reference-type="ref+Label" data-reference="prop:homogeneous-system-subspace">Proposition 3.18</a> to see this is a subspace: $V$ is the solution space of the equation $z = 0$ (in the three variables $x, y, z$), which is a homogeneous linear equation. The following statement asserts that we always obtain a subspace in this manner.

<p class="env-number"><strong>Lemma 3.34</strong> (Related exercises: <a href="../exercises-maps/#ex-maps-partial-2026-1">Exercise 4.46</a>, <a href="../exercises-spaces/#ex-matrix-subspace">Exercise 3.14</a>, <a href="../exercises-spaces/#ex-polynomial-subspaces">Exercise 3.9</a>, <a href="../exercises-spaces/#ex-spaces-2-3">Exercise 3.16</a>, <a href="../exercises-spaces/#ex-span-r4">Exercise 3.5</a>)</p>

*Proof.* We check the three conditions in <a href="../spaces-definition-solution-of-homogeneous/#def-subspace" data-reference-type="ref+Label" data-reference="def:subspace">Definition 3.17</a>. Let us abbreviate $L := L(v_1, \dots, v_m)$.

<span id="ex-spaces-example-012" label="ex:spaces-example-012"></span> In <a href="#ex-span-2" data-reference-type="ref+Label" data-reference="ex:span-2">Example 3.33</a>, we have
<div class="arithmatex" markdown="1">
\[
L((1,0,0), (0,1,0)) = \{(x,y,0) \ | \ x, y, \in {\bf R} \}.
\]
</div>

<a href="../exercises-spaces/#ex-poly-span-1" data-reference-type="ref+Label" data-reference="ex poly span 1">Exercise 3.10</a> and <a href="../exercises-spaces/#ex-poly-span-2" data-reference-type="ref+Label" data-reference="ex poly span 2">Exercise 3.11</a> discuss linear combinations in the vector space ${\bf R}[x]^{\le 3}$. The span is closely related to another construction that produces new vector spaces out of given ones:

<p class="env-number"><strong>Definition 3.36</strong> (Related exercises: <a href="../exercises-spaces/#ex-spaces-2-4">Exercise 3.25</a>, <a href="../exercises-spaces/#ex-sum-intersection-r4">Exercise 3.26</a>)</p>

The proof of this is very similar to the one of <a href="#lem-span-subspace" data-reference-type="ref+Label" data-reference="lem:span-subspace">Lemma 3.34</a> and will be omitted.

<span id="rem-spaces-remark-006" label="rem:spaces-remark-006"></span> The sum is *completely different* from the union $A \cup B$ of the two subspaces. We have seen in <a href="../spaces-definition-solution-of-homogeneous/#ex-non-vector-spaces" data-reference-type="ref+Label" data-reference="ex:non-vector-spaces">Example 3.13</a> that the union is (in general) not even a subspace (just a subset). We have
<div class="arithmatex" markdown="1">
\[
A \cup B \subset A + B,
\]
</div>
but these two subsets are distinct (unless $A$ or $B$ only consists of the zero vector). To see this inclusion, note that $A \subset A + B$. Indeed, the zero vector $0 \in B$ (since it is a subspace!), and for any $v \in A$, we have $v = v + 0 \in A + B$. Similarly, $B \subset A + B$, and therefore $A \cup B \subset A + B$.

In a spirit similar to <a href="../spaces-intersection/#q-dimension-intersection" data-reference-type="ref+Label" data-reference="q:dimension-intersection">Question 3.21</a> we can ask the following question:

It turns out that <a href="../spaces-intersection/#q-dimension-intersection" data-reference-type="ref+Label" data-reference="q:dimension-intersection">Question 3.21</a> are closely related. Loosely speaking, one can say that $A + B$ “gets bigger” the same way as $A \cap B$ “gets smaller”. To give a precise meaning to this one needs the concept of the dimension of a vector space. Understanding the dimension of a vector space requires combining two preliminary notions, that of a generating system and that of linear independence below (<a href="../spaces-linear-independence/#def-linearly-independent" data-reference-type="ref+Label" data-reference="def:linearly-independent">Definition 3.49</a>).

<p class="env-number"><strong>Definition 3.42</strong> (Related exercises: <a href="../exercises-spaces/#ex-mat-subspace-dim">Exercise 3.24</a>, <a href="../exercises-spaces/#ex-wk-basis">Exercise 3.23</a>)</p>

<span id="ex-spaces-example-014" label="ex:spaces-example-014"></span> We have observed in <a href="#ex-span-2" data-reference-type="ref+Label" data-reference="ex:span-2">Example 3.33</a> that the vectors $e_1 = (1, 0, 0)$ and $e_2 = (0, 1, 0)$ in ${\bf R}^3$ are *not* a generating system since they only span the subspace
<div class="arithmatex" markdown="1">
\[
L(e_1, e_2) = \{ (x, y, 0) \ | \ x, y \in {\bf R} \}
\]
</div>
which is not the entire ${\bf R}^3$ (e.g., $(0,0,1)$ is missing).

<p class="env-number"><strong>Method 3.46</strong> (Related exercises: <a href="../exercises-maps/#ex-maps-3-5">Exercise 4.15</a>, <a href="../exercises-spaces/#ex-spaces-2-4">Exercise 3.25</a>)</p>